{"schema":1,"channel":"stable","releaseId":"fixture-0.8.0","publishedAtUtc":"2026-09-29T14:35:00Z","rolloutPercentage":100,"minimumProtocolVersion":1,"artifacts":[{"platform":"android","version":"0.8.0","build":11,"url":"https://updates.tablink.example/releases/0.8.0/TabLink.apk","size":1234,"sha256":"0000000000000000000000000000000000000000000000000000000000000000","installerUrl":"https://updates.tablink.example/releases/0.8.0/TabLink.apk","notes":"跨平台签名互操作测试"}]}
